{
  "type": "claim",
  "grounding": "G1",
  "id": "hrm:claim/transgenic-epidermal-stem-cells-regenerate-functional-epidermis-jeb",
  "statement": "Autologous epidermal stem cells corrected with a retroviral vector regenerated a durable, functional, self-renewing epidermis in patients with junctional epidermolysis bullosa: nine grafts on an adult's legs stable at one year (2006), and an entire epidermis on ~80% of a child's body surface (2017).",
  "context": {
    "species": "human",
    "model": "junctional epidermolysis bullosa (LAMB3 mutations)",
    "intervention": "ex vivo retroviral LAMB3 correction of epidermal stem cells; cultured grafts",
    "comparator": "none (single patients)"
  },
  "measurement": {
    "measured": "function",
    "assay": "clinical follow-up; integration-site analysis; clonal tracing",
    "endpoint": "stable, blister-free, adherent epidermis",
    "effect": "full functional correction of grafted areas; maintained by a defined repertoire of transduced stem cells"
  },
  "evidence": [
    {
      "source": "hrm:source/mavilio-2006-natmed",
      "design": "case-report",
      "locator": "abstract",
      "n": "1"
    },
    {
      "source": "hrm:source/hirsch-2017-nature",
      "design": "case-report",
      "locator": "abstract",
      "n": "1"
    }
  ],
  "rung": "L4",
  "replication": {
    "independentGroups": 0,
    "note": "Both patients treated by the same group (De Luca). Two successes, no independent replication — L4, not L5."
  },
  "status": {
    "peerReviewed": true
  },
  "supports": [
    "hrm:capability/epidermis-gene-corrected-stem-cell-replacement"
  ],
  "drift": "'Boy given new skin' — the regenerated organ is the epidermis; the dermis was his own.",
  "wouldMove": "An unaffiliated centre reproducing durable engraftment, with integration-site surveillance beyond five years.",
  "provenance": {
    "proposedBy": {
      "type": "ai",
      "name": "Claude Code session e7dc5601 (Anthropic)",
      "model": "claude-opus-5",
      "session": "e7dc5601-1690-47c6-bf13-9ca150d31960"
    },
    "method": "manual reasoning from the cited sources' abstracts (PubMed) and Crossref metadata, checked 2026-09-11; no source opened at figure level",
    "date": "2026-09-11",
    "evidenceAccessed": [
      "hrm:source/mavilio-2006-natmed",
      "hrm:source/hirsch-2017-nature"
    ]
  },
  "review": {
    "state": "ai-proposed",
    "date": "2026-09-11"
  }
}
