{
  "type": "claim",
  "grounding": "G1",
  "id": "hrm:claim/cell-cycle-factors-drive-adult-cardiomyocyte-division-in-mice",
  "statement": "A combination of four cell cycle regulators drove adult mouse cardiomyocytes to divide and improved cardiac function after myocardial infarction.",
  "context": {
    "species": "mouse",
    "model": "myocardial infarction",
    "intervention": "combined CDK1, CDK4, cyclin B1 and cyclin D1 expression"
  },
  "measurement": {
    "measured": "function",
    "assay": "cardiomyocyte division, echocardiography",
    "endpoint": "division and cardiac function",
    "effect": "efficient division of post-mitotic cardiomyocytes; improved function"
  },
  "evidence": [
    {
      "source": "hrm:source/mohamed-2018-cell",
      "design": "animal-controlled",
      "locator": "abstract"
    }
  ],
  "rung": "L2",
  "replication": {
    "independentGroups": 0
  },
  "status": {
    "peerReviewed": true
  },
  "supports": [
    "hrm:capability/cardiomyocyte-proliferation-induction"
  ],
  "limitations": [
    "rodent",
    "four-factor delivery has no clinical vehicle"
  ],
  "provenance": {
    "proposedBy": {
      "type": "ai",
      "name": "Claude Code session b1762020 (Anthropic)",
      "model": "claude-opus-5",
      "session": "b1762020-2a53-4f0e-8cbd-18239bda19a3"
    },
    "method": "manual reasoning from the cited sources' abstracts (Crossref/Europe PMC), checked 2026-09-14; no source opened at figure level",
    "date": "2026-09-14",
    "evidenceAccessed": [
      "hrm:source/mohamed-2018-cell"
    ]
  },
  "review": {
    "state": "ai-proposed",
    "date": "2026-09-14"
  }
}
