{
  "type": "claim",
  "grounding": "G1",
  "id": "hrm:claim/epidural-stimulation-enables-overground-walking",
  "statement": "Participants with chronic motor-complete spinal cord injury achieved voluntary over-ground walking with lumbosacral epidural stimulation combined with intensive locomotor training.",
  "context": {
    "species": "human",
    "model": "chronic motor-complete spinal cord injury",
    "intervention": "epidural stimulation plus locomotor training"
  },
  "measurement": {
    "measured": "function",
    "assay": "over-ground walking, stepping kinematics",
    "endpoint": "voluntary stepping and walking",
    "effect": "over-ground walking achieved in some participants"
  },
  "evidence": [
    {
      "source": "hrm:source/angeli-2018-nejm",
      "design": "case-series",
      "locator": "abstract",
      "n": "4"
    },
    {
      "source": "hrm:source/gill-2018-natmed",
      "design": "case-report",
      "locator": "abstract",
      "n": "1"
    }
  ],
  "rung": "L4",
  "replication": {
    "independentGroups": 2,
    "note": "Two unaffiliated groups (Louisville; Mayo) reported the same category of result in the same year."
  },
  "status": {
    "peerReviewed": true
  },
  "supports": [
    "hrm:capability/spinal-circuit-reactivation-by-stimulation"
  ],
  "limitations": [
    "single-digit participant numbers",
    "months of training and a specialised setting",
    "spared descending fibres cannot be excluded"
  ],
  "provenance": {
    "proposedBy": {
      "type": "ai",
      "name": "Claude Code session b1762020 (Anthropic)",
      "model": "claude-opus-5",
      "session": "b1762020-2a53-4f0e-8cbd-18239bda19a3"
    },
    "method": "manual reasoning from the cited sources' abstracts (Crossref/Europe PMC), checked 2026-09-14; no source opened at figure level",
    "date": "2026-09-14",
    "evidenceAccessed": [
      "hrm:source/angeli-2018-nejm",
      "hrm:source/gill-2018-natmed"
    ]
  },
  "review": {
    "state": "ai-proposed",
    "date": "2026-09-14"
  }
}
