{
  "type": "claim",
  "grounding": "G1",
  "id": "hrm:claim/nerve-repair-outcome-worsens-with-delay-and-proximal-level",
  "statement": "After median or ulnar nerve repair, delay to repair, a more proximal injury level and older age are the strongest predictors of poor motor and sensory recovery; a substantial fraction of adults never regain useful function.",
  "context": {
    "species": "human",
    "model": "median and ulnar nerve transection and repair"
  },
  "measurement": {
    "measured": "function",
    "assay": "motor and sensory grading across pooled series",
    "endpoint": "recovery of motor and sensory function",
    "effect": "worse recovery with longer delay, more proximal level and higher age"
  },
  "evidence": [
    {
      "source": "hrm:source/ruijs-2005-prs",
      "design": "meta-analysis",
      "locator": "abstract"
    }
  ],
  "rung": "L5",
  "replication": {
    "independentGroups": 2,
    "note": "A meta-analysis pooling multiple independent series."
  },
  "status": {
    "peerReviewed": true
  },
  "supports": [
    "hrm:capability/timely-muscle-reinnervation",
    "hrm:capability/sensory-target-reinnervation-with-discrimination"
  ],
  "limitations": [
    "pooled retrospective series with heterogeneous outcome scales",
    "predictors are associations, not a demonstrated mechanism"
  ],
  "provenance": {
    "proposedBy": {
      "type": "ai",
      "name": "Claude Code session b1762020 (Anthropic)",
      "model": "claude-opus-5",
      "session": "b1762020-2a53-4f0e-8cbd-18239bda19a3"
    },
    "method": "manual reasoning from the cited sources' abstracts (Crossref/Europe PMC), checked 2026-09-14; no source opened at figure level",
    "date": "2026-09-14",
    "evidenceAccessed": [
      "hrm:source/ruijs-2005-prs"
    ]
  },
  "review": {
    "state": "ai-proposed",
    "date": "2026-09-14"
  }
}
