{
  "type": "claim",
  "grounding": "G1",
  "id": "hrm:claim/glioblastoma-cells-occupy-interconvertible-states",
  "statement": "Single-cell profiling shows that glioblastoma cells within one tumour occupy four main cellular states, influenced by genetics and the microenvironment, and can transition between them.",
  "context": {
    "species": "human",
    "model": "primary glioblastoma tumours, single-cell RNA sequencing"
  },
  "measurement": {
    "measured": "structure",
    "assay": "single-cell RNA sequencing; lineage and state analysis",
    "endpoint": "intratumoral heterogeneity and plasticity",
    "effect": "four interconvertible states within individual tumours"
  },
  "evidence": [
    {
      "source": "hrm:source/neftel-2019-cell",
      "design": "observational-human",
      "locator": "abstract"
    },
    {
      "source": "hrm:source/patel-2014-science",
      "design": "observational-human",
      "locator": "abstract"
    }
  ],
  "rung": "L5",
  "replication": {
    "independentGroups": 2,
    "note": "Two independent studies, five years apart, in human tumours."
  },
  "status": {
    "peerReviewed": true
  },
  "supports": [
    "hrm:capability/gbm-antigen-escape-prevention"
  ],
  "contradicts": [
    "hrm:capability/gbm-targeted-cytotoxic-therapy"
  ],
  "provenance": {
    "proposedBy": {
      "type": "ai",
      "name": "Claude Code session b1762020 (Anthropic)",
      "model": "claude-opus-5",
      "session": "b1762020-2a53-4f0e-8cbd-18239bda19a3"
    },
    "method": "manual reasoning from the cited sources' abstracts (Crossref/Europe PMC), checked 2026-09-14; no source opened at figure level",
    "date": "2026-09-14",
    "evidenceAccessed": [
      "hrm:source/neftel-2019-cell",
      "hrm:source/patel-2014-science"
    ]
  },
  "review": {
    "state": "ai-proposed",
    "date": "2026-09-14"
  }
}
