{
  "type": "claim",
  "grounding": "G1",
  "id": "hrm:claim/intraventricular-car-t-produces-rapid-but-transient-gbm-regression",
  "statement": "CAR T cells delivered into the ventricles or intrathecally produced rapid, radiographically dramatic regression of recurrent glioblastoma in a small number of patients; in most, the tumour progressed again within months.",
  "context": {
    "species": "human",
    "model": "recurrent glioblastoma",
    "intervention": "intraventricular or intrathecal CAR T (IL13Ralpha2; bivalent EGFR/IL13Ralpha2; CARv3-TEAM-E)"
  },
  "measurement": {
    "measured": "structure",
    "assay": "MRI response",
    "endpoint": "radiographic tumour response and its duration",
    "effect": "regression within days to weeks; durable in a minority"
  },
  "evidence": [
    {
      "source": "hrm:source/brown-2016-nejm",
      "design": "case-report",
      "locator": "abstract",
      "n": "1"
    },
    {
      "source": "hrm:source/bagley-2024-natmed",
      "design": "case-series",
      "locator": "abstract",
      "n": "3"
    },
    {
      "source": "hrm:source/choi-2024-nejm",
      "design": "case-series",
      "locator": "abstract",
      "n": "3"
    }
  ],
  "rung": "L4",
  "replication": {
    "independentGroups": 2,
    "note": "Three groups (City of Hope; Penn; Mass General), three different constructs, the same pattern of rapid response and limited durability."
  },
  "status": {
    "peerReviewed": true
  },
  "supports": [
    "hrm:capability/gbm-immune-cell-therapy"
  ],
  "drift": "'CAR T shrinks brain tumours' is accurate and is not the same as 'CAR T treats glioblastoma'. Seven patients across three reports, and the tumours came back in most of them.",
  "limitations": [
    "single-digit patient numbers",
    "radiographic endpoints",
    "no survival comparison"
  ],
  "provenance": {
    "proposedBy": {
      "type": "ai",
      "name": "Claude Code session b1762020 (Anthropic)",
      "model": "claude-opus-5",
      "session": "b1762020-2a53-4f0e-8cbd-18239bda19a3"
    },
    "method": "manual reasoning from the cited sources' abstracts (Crossref/Europe PMC), checked 2026-09-14; no source opened at figure level",
    "date": "2026-09-14",
    "evidenceAccessed": [
      "hrm:source/brown-2016-nejm",
      "hrm:source/bagley-2024-natmed",
      "hrm:source/choi-2024-nejm"
    ]
  },
  "review": {
    "state": "ai-proposed",
    "date": "2026-09-14"
  }
}
