{
  "type": "claim",
  "grounding": "G1",
  "id": "hrm:claim/neonatal-mouse-heart-regenerates-then-loses-the-ability",
  "statement": "The neonatal mouse heart fully regenerates after resection of part of the ventricle, and loses that ability within about the first week of life.",
  "context": {
    "species": "mouse",
    "model": "apical resection at day 1 versus day 7"
  },
  "measurement": {
    "measured": "structure",
    "assay": "histology, function",
    "endpoint": "restoration of ventricular myocardium",
    "effect": "complete regeneration at day 1; scar at day 7"
  },
  "evidence": [
    {
      "source": "hrm:source/porrello-2011-science",
      "design": "animal-controlled",
      "locator": "abstract"
    }
  ],
  "rung": "L2",
  "replication": {
    "independentGroups": 2,
    "note": "Widely reproduced, with debate about resection versus infarction models."
  },
  "status": {
    "peerReviewed": true
  },
  "supports": [
    "hrm:capability/cardiomyocyte-proliferation-induction"
  ],
  "limitations": [
    "a developmental window in a rodent; the adult human is the opposite end of that window"
  ],
  "provenance": {
    "proposedBy": {
      "type": "ai",
      "name": "Claude Code session b1762020 (Anthropic)",
      "model": "claude-opus-5",
      "session": "b1762020-2a53-4f0e-8cbd-18239bda19a3"
    },
    "method": "manual reasoning from the cited sources' abstracts (Crossref/Europe PMC), checked 2026-09-14; no source opened at figure level",
    "date": "2026-09-14",
    "evidenceAccessed": [
      "hrm:source/porrello-2011-science"
    ]
  },
  "review": {
    "state": "ai-proposed",
    "date": "2026-09-14"
  }
}
