{
  "type": "claim",
  "grounding": "G1",
  "id": "hrm:claim/temozolomide-chemoradiation-extends-gbm-survival-by-months",
  "statement": "Radiotherapy with concomitant and adjuvant temozolomide extended median survival in newly diagnosed glioblastoma from 12.1 to 14.6 months, and two-year survival from 10% to 26%, compared with radiotherapy alone.",
  "context": {
    "species": "human",
    "model": "newly diagnosed glioblastoma",
    "intervention": "radiotherapy plus temozolomide",
    "comparator": "radiotherapy alone"
  },
  "measurement": {
    "measured": "function",
    "assay": "overall survival",
    "endpoint": "median and two-year survival",
    "effect": "+2.5 months median; 10% to 26% at two years"
  },
  "evidence": [
    {
      "source": "hrm:source/stupp-2005-nejm",
      "design": "rct",
      "locator": "abstract"
    }
  ],
  "rung": "L5",
  "replication": {
    "independentGroups": 2,
    "note": "Adopted worldwide as the standard of care and confirmed in subsequent cohorts."
  },
  "status": {
    "peerReviewed": true
  },
  "supports": [
    "hrm:capability/gbm-tumour-cell-eradication"
  ],
  "limitations": [
    "the benefit is measured in months and no patient is cured"
  ],
  "provenance": {
    "proposedBy": {
      "type": "ai",
      "name": "Claude Code session b1762020 (Anthropic)",
      "model": "claude-opus-5",
      "session": "b1762020-2a53-4f0e-8cbd-18239bda19a3"
    },
    "method": "manual reasoning from the cited sources' abstracts (Crossref/Europe PMC), checked 2026-09-14; no source opened at figure level",
    "date": "2026-09-14",
    "evidenceAccessed": [
      "hrm:source/stupp-2005-nejm"
    ]
  },
  "review": {
    "state": "ai-proposed",
    "date": "2026-09-14"
  }
}
