{
  "type": "claim",
  "grounding": "G1",
  "id": "hrm:claim/brain-spine-interface-restores-volitional-walking",
  "statement": "A digital bridge decoding cortical activity and driving epidural stimulation restored natural, volitional walking in a participant with chronic tetraplegia, with neurological improvement that persisted when the bridge was switched off.",
  "context": {
    "species": "human",
    "model": "chronic tetraplegia after cervical spinal cord injury",
    "intervention": "brain-spine interface: cortical decoding driving spinal stimulation"
  },
  "measurement": {
    "measured": "function",
    "assay": "walking on ground and stairs, volitional control",
    "endpoint": "natural walking under volitional control",
    "effect": "walking restored; improvement retained with stimulation off"
  },
  "evidence": [
    {
      "source": "hrm:source/lorach-2023-nature",
      "design": "case-report",
      "locator": "abstract",
      "n": "1"
    }
  ],
  "rung": "L4",
  "replication": {
    "independentGroups": 0,
    "note": "One participant, one group."
  },
  "status": {
    "peerReviewed": true
  },
  "supports": [
    "hrm:capability/brain-spine-interface-volitional-control"
  ],
  "limitations": [
    "n=1",
    "two implanted systems and continuous technical support",
    "the persistence effect has no replication"
  ],
  "provenance": {
    "proposedBy": {
      "type": "ai",
      "name": "Claude Code session b1762020 (Anthropic)",
      "model": "claude-opus-5",
      "session": "b1762020-2a53-4f0e-8cbd-18239bda19a3"
    },
    "method": "manual reasoning from the cited sources' abstracts (Crossref/Europe PMC), checked 2026-09-14; no source opened at figure level",
    "date": "2026-09-14",
    "evidenceAccessed": [
      "hrm:source/lorach-2023-nature"
    ]
  },
  "review": {
    "state": "ai-proposed",
    "date": "2026-09-14"
  }
}
