{
  "type": "claim",
  "grounding": "G1",
  "id": "hrm:claim/glioma-cells-receive-synaptic-input-from-neurons",
  "statement": "Glioma cells form functional glutamatergic synapses with neurons, and this synaptic input drives tumour progression and invasion.",
  "context": {
    "species": "human tissue and mouse xenograft",
    "model": "glioma cells in brain",
    "intervention": "none (mechanistic)"
  },
  "measurement": {
    "measured": "structure",
    "assay": "electrophysiology, electron microscopy, calcium imaging",
    "endpoint": "neuron-to-glioma synaptic transmission and its effect on growth",
    "effect": "functional synapses that promote invasion and growth"
  },
  "evidence": [
    {
      "source": "hrm:source/venkataramani-2019-nature",
      "design": "animal-controlled",
      "locator": "abstract"
    }
  ],
  "rung": "L2",
  "replication": {
    "independentGroups": 2,
    "note": "Reported simultaneously by more than one group in 2019; the companion studies are not cited here."
  },
  "status": {
    "peerReviewed": true
  },
  "supports": [
    "hrm:capability/gbm-infiltrative-margin-clearance"
  ],
  "limitations": [
    "mechanistic; no therapy follows from it yet"
  ],
  "provenance": {
    "proposedBy": {
      "type": "ai",
      "name": "Claude Code session b1762020 (Anthropic)",
      "model": "claude-opus-5",
      "session": "b1762020-2a53-4f0e-8cbd-18239bda19a3"
    },
    "method": "manual reasoning from the cited sources' abstracts (Crossref/Europe PMC), checked 2026-09-14; no source opened at figure level",
    "date": "2026-09-14",
    "evidenceAccessed": [
      "hrm:source/venkataramani-2019-nature"
    ]
  },
  "review": {
    "state": "ai-proposed",
    "date": "2026-09-14"
  }
}
