{
  "type": "claim",
  "grounding": "G1",
  "id": "hrm:claim/neurotrophins-enhance-angiogenesis-in-engineered-skin",
  "statement": "In a human tissue-engineered skin model, nerve growth factor, BDNF, NT-3 and GDNF enhanced angiogenesis, coupling innervation signals to vascular growth in vitro.",
  "context": {
    "species": "human cells in vitro",
    "model": "tissue-engineered skin with endothelial cells",
    "intervention": "neurotrophic factors"
  },
  "measurement": {
    "measured": "structure",
    "assay": "capillary-like network formation",
    "endpoint": "angiogenesis in the construct",
    "effect": "increased capillary-like network formation with neurotrophins"
  },
  "evidence": [
    {
      "source": "hrm:source/blais-2013-tissueeng",
      "design": "in-vitro",
      "locator": "abstract"
    }
  ],
  "rung": "L1",
  "replication": {
    "independentGroups": 0
  },
  "status": {
    "peerReviewed": true
  },
  "supports": [
    "hrm:capability/cutaneous-sensory-reinnervation"
  ],
  "provenance": {
    "proposedBy": {
      "type": "ai",
      "name": "Claude Code session e7dc5601 (Anthropic)",
      "model": "claude-opus-5",
      "session": "e7dc5601-1690-47c6-bf13-9ca150d31960"
    },
    "method": "manual reasoning from the cited sources' abstracts (PubMed) and Crossref metadata, checked 2026-09-11; no source opened at figure level",
    "date": "2026-09-11",
    "evidenceAccessed": [
      "hrm:source/blais-2013-tissueeng"
    ]
  },
  "review": {
    "state": "ai-proposed",
    "date": "2026-09-11"
  }
}
