{
  "type": "claim",
  "grounding": "G1",
  "id": "hrm:claim/thick-engineered-tissue-vascularisation-unsolved",
  "statement": "Vascularisation of engineered tissue beyond the diffusion limit remains an unsolved problem: prevascularisation and angiogenic strategies yield capillary networks in rodent constructs but not organised, stable, clinically usable vasculature in thick human tissue.",
  "context": {
    "species": "multiple",
    "model": "engineered and regenerated tissues"
  },
  "measurement": {
    "measured": "none",
    "endpoint": "clinically usable perfused vasculature in thick constructs",
    "effect": "not achieved"
  },
  "evidence": [
    {
      "source": "hrm:source/rouwkema-2016-trendsbiotech",
      "design": "review",
      "locator": "abstract"
    },
    {
      "source": "hrm:source/laschke-2016-biotechadv",
      "design": "review",
      "locator": "abstract"
    }
  ],
  "rung": "L2",
  "replication": {
    "independentGroups": 2,
    "note": "Two independent reviews reaching the same assessment."
  },
  "status": {
    "peerReviewed": true
  },
  "contradicts": [
    "hrm:capability/organised-microvascular-network-in-regenerated-dermis"
  ],
  "limitations": [
    "reviews; the rung L2 reflects the best demonstrations they survey (rodent)"
  ],
  "provenance": {
    "proposedBy": {
      "type": "ai",
      "name": "Claude Code session e7dc5601 (Anthropic)",
      "model": "claude-opus-5",
      "session": "e7dc5601-1690-47c6-bf13-9ca150d31960"
    },
    "method": "manual reasoning from the cited sources' abstracts (PubMed) and Crossref metadata, checked 2026-09-11; no source opened at figure level",
    "date": "2026-09-11",
    "evidenceAccessed": [
      "hrm:source/rouwkema-2016-trendsbiotech",
      "hrm:source/laschke-2016-biotechadv"
    ]
  },
  "review": {
    "state": "ai-proposed",
    "date": "2026-09-11"
  }
}
