{
  "type": "claim",
  "grounding": "G1",
  "id": "hrm:claim/pulsed-ultrasound-opens-the-barrier-in-patients",
  "statement": "Pulsed ultrasound with an implanted device and intravenous microbubbles repeatedly and safely opened the blood-brain barrier in patients with recurrent glioblastoma, demonstrated by contrast enhancement.",
  "context": {
    "species": "human",
    "model": "recurrent glioblastoma",
    "intervention": "implantable pulsed ultrasound plus microbubbles before chemotherapy"
  },
  "measurement": {
    "measured": "access",
    "assay": "contrast-enhanced MRI; safety",
    "endpoint": "barrier opening",
    "effect": "repeated transient opening without significant toxicity"
  },
  "evidence": [
    {
      "source": "hrm:source/carpentier-2016-scitranslmed",
      "design": "case-series",
      "locator": "abstract",
      "n": "15"
    }
  ],
  "rung": "L4",
  "replication": {
    "independentGroups": 1,
    "note": "Reproduced by other groups with focused ultrasound since; those reports are not cited here."
  },
  "status": {
    "peerReviewed": true
  },
  "supports": [
    "hrm:capability/cns-drug-delivery-past-the-barrier"
  ],
  "limitations": [
    "access demonstrated, not a survival benefit",
    "opening is local and transient"
  ],
  "provenance": {
    "proposedBy": {
      "type": "ai",
      "name": "Claude Code session b1762020 (Anthropic)",
      "model": "claude-opus-5",
      "session": "b1762020-2a53-4f0e-8cbd-18239bda19a3"
    },
    "method": "manual reasoning from the cited sources' abstracts (Crossref/Europe PMC), checked 2026-09-14; no source opened at figure level",
    "date": "2026-09-14",
    "evidenceAccessed": [
      "hrm:source/carpentier-2016-scitranslmed"
    ]
  },
  "review": {
    "state": "ai-proposed",
    "date": "2026-09-14"
  }
}
