{
  "type": "claim",
  "grounding": "G1",
  "id": "hrm:claim/no-therapy-reverses-established-fibrosis",
  "statement": "No approved therapy reverses established organ fibrosis; current antifibrotic drugs slow progression, and fibrosis remains a major cause of irreversible organ dysfunction.",
  "context": {
    "species": "human",
    "model": "fibrotic disease across organs"
  },
  "measurement": {
    "measured": "none",
    "endpoint": "reversal of established fibrosis",
    "effect": "not achieved by any approved therapy"
  },
  "evidence": [
    {
      "source": "hrm:source/henderson-2020-nature",
      "design": "review",
      "locator": "abstract"
    }
  ],
  "rung": "L0",
  "replication": {
    "independentGroups": 1,
    "note": "Review-level statement of the field's position."
  },
  "status": {
    "peerReviewed": true
  },
  "contradicts": [
    "hrm:capability/established-dermal-scar-reversal"
  ],
  "provenance": {
    "proposedBy": {
      "type": "ai",
      "name": "Claude Code session e7dc5601 (Anthropic)",
      "model": "claude-opus-5",
      "session": "e7dc5601-1690-47c6-bf13-9ca150d31960"
    },
    "method": "manual reasoning from the cited sources' abstracts (PubMed) and Crossref metadata, checked 2026-09-11; no source opened at figure level",
    "date": "2026-09-11",
    "evidenceAccessed": [
      "hrm:source/henderson-2020-nature"
    ]
  },
  "review": {
    "state": "ai-proposed",
    "date": "2026-09-11"
  }
}
