{
  "type": "claim",
  "grounding": "G1",
  "id": "hrm:claim/brief-electrical-stimulation-accelerates-human-reinnervation",
  "statement": "One hour of 20 Hz electrical stimulation of the median nerve at the time of carpal tunnel surgery accelerated axon outgrowth and improved muscle reinnervation in patients compared with surgery alone.",
  "context": {
    "species": "human",
    "model": "chronic median nerve compression at the wrist",
    "intervention": "1 h 20 Hz intraoperative stimulation",
    "comparator": "surgery alone"
  },
  "measurement": {
    "measured": "function",
    "assay": "motor unit number estimation and electrophysiology",
    "endpoint": "muscle reinnervation",
    "effect": "faster and more complete reinnervation with stimulation"
  },
  "evidence": [
    {
      "source": "hrm:source/gordon-2010-expneurol",
      "design": "controlled-trial",
      "locator": "abstract"
    }
  ],
  "rung": "L4",
  "replication": {
    "independentGroups": 0,
    "note": "One group (Gordon); the mechanism is supported by extensive rodent work from the same laboratory."
  },
  "status": {
    "peerReviewed": true
  },
  "supports": [
    "hrm:capability/regeneration-speed-increase"
  ],
  "limitations": [
    "a compression injury over a short distance, not a transection over a long one",
    "electrophysiological endpoints rather than restored hand function"
  ],
  "provenance": {
    "proposedBy": {
      "type": "ai",
      "name": "Claude Code session b1762020 (Anthropic)",
      "model": "claude-opus-5",
      "session": "b1762020-2a53-4f0e-8cbd-18239bda19a3"
    },
    "method": "manual reasoning from the cited sources' abstracts (Crossref/Europe PMC), checked 2026-09-14; no source opened at figure level",
    "date": "2026-09-14",
    "evidenceAccessed": [
      "hrm:source/gordon-2010-expneurol"
    ]
  },
  "review": {
    "state": "ai-proposed",
    "date": "2026-09-14"
  }
}
